sent,rank,rank_a,cluster,type,num
Something that makes me unique is my ability to create simple instructions for complex tasks.,89,191,191,u,217
One thing that makes me unique is my openess to new ideas and people.,11,7,7,u,218
My sizable work ethic and willingness to sacrifice leisure hours.,79,223,223,l,219
My inability to relax properly or cool down after a long job.,75,29,29,d,219
"My masterful piano skills, which incorporate electronic and dance yet hearken back to classical and Baroque pieces.",74,165,165,u,219
I like my capacity to grow and learn from ever-shifting situations.,70,208,208,l,220
"That's hard to say, because I'm limited like everyone else, but I tend to adapt.",4,3,3,d,220
"The me-ness of me, something you can only know by knowing me.",85,185,185,u,220
im kind of stupid,41,281,281,d,221
i dont like that i am shy,0,8,8,d,222
i am athletic,17,25,25,l,223
i can be lazy,1,10,10,d,223
my dream is to swim the english channel,127,178,178,u,223
"I'm a pretty smart guy, overall.",38,56,56,l,224
I don't like that I'm passive.,74,206,206,d,225
I am a very tall Asian.,31,86,86,u,225
"I don't like my abs and core, they are thick and chubby.",73,201,201,d,226
I am a visual artist who sees the world as a piece of art.,105,116,116,u,226
"I""m very compassionate and have a great  deal of empathy for others.",43,129,129,l,227
I tend to procrastinate and always finish things at the last minute.,99,104,104,d,227
I'm very unique and don't copy others.,0,0,0,u,227
I have a hard time achieving goals at times,4,3,3,d,229
I think that i am generally much friendlier than others.,117,259,259,u,229
I am unique because I have quit everything I ever started.,0,0,0,u,230
I have the ability to see things from other people's perspective on a regular basis.,5,5,5,l,231
I am a 7th generation Texan with family dating back to the 1840s.,65,146,146,u,231
I'm not fond of my waistline.,37,190,190,d,232
I am talented and creative.,0,2,2,l,233
I am a little lazy and like to procrastinate.,1,10,10,d,233
I have a large family.,21,34,34,u,233
I wish I was a couple of inches taller.,29,52,52,d,235
I am a very positive person,12,12,12,l,236
I am usually always happy,28,30,30,u,236
I like that I am creative.,0,2,2,l,237
I don't like that I feel jealous of others at times.,12,48,48,d,237
I an uniquely funny and I say interesting things that catch people off-guard sometimes.,16,13,13,u,237
I like that I am good at a lot of things.,1,1,1,l,238
"I am unique because I am juggle, and not many people can do that.",0,0,0,u,238
I like that I'm trying to better myself.,13,21,21,l,239
I put the needs of others before my own needs too often.,21,20,20,d,240
I listen to types of music that most people don't listen to.,26,26,26,u,240
"I think I'm fairly creative, and can write critically.",0,2,2,l,241
I wish I was more forward and aggressive sometimes. I let a lot of things slide.,10,45,45,d,241
I like that I am attractive.,18,22,22,l,242
I think I am unique because I was in the Air Force.,0,0,0,u,242
I am intelligent and hard working.,6,16,16,l,243
I suffer from chronic pain.,70,195,195,d,243
I have two different colored eyes.,2,14,14,u,243
"I'm creative, friendly, nice, hard working, and I'm great in bed.",0,2,2,l,244
"I can be be non-confrontational or timid, especially at inopportune times.",54,97,97,d,244
"Too many things to name I suppose, but I'd say I'm unique because of my creativity.",7,11,11,u,244
I like that I am sociable because it helps me to adapt to situations.,59,174,174,l,245
I do not like that I have a bad habit of procrastinating which frequently makes me miss deadlines.,6,23,23,d,245
The fact that I am a 6'2'' female makes me unique because I am a foot taller than some of my friends,15,40,40,u,245
I am very good at painting nails.,1,1,1,u,246
"I like my ability to react quickly in stressful, demanding situations.",54,151,151,l,247
I don't like my ever-growing beer belly.,67,196,196,d,247
I waste too much time doing unimportant things.,38,123,123,d,248
i liked how i am nice.,4,9,9,l,249
i dont like how i can be mean.,7,36,36,d,249
i am very good with technology.,1,1,1,u,249
I like my strong moral character.,10,15,15,l,250
