sent,rank,rank_a,cluster,type,num
I like the fact that I have very good physical endurance.,1,2,2,l,1
I don't like the fact that I am getting old.,106,58,58,d,1
My ability to concentrate and focus for prolonged periods of time are judged unique by people who know me.,0,0,0,u,1
I like that I am confident and positive,162,159,159,l,2
I don't like how I am sometimes ungrateful for my blessings,188,422,422,d,2
I am obsessed with crossfit,79,417,417,u,2
I like the fact I'm healthy.,132,67,67,l,3
That I'm limited by my size.,26,93,93,d,3
I can speak three languages fluently.,86,207,207,u,3
I have a great sense of humor and people tell me I am funny.,2,8,8,l,4
I am about 20 pounds overwieght.,93,554,554,d,4
"I have eyes that are almost yellow, a very different shade of green.",68,198,198,u,4
I think that I  have a great kind personality,2,8,8,l,5
I think that I let people take advantage of my kindness,14,12,12,d,5
"I am an accountant, but can make wedding style decorated cakes",212,596,596,u,5
How I take my responsibilities serious.,224,631,631,l,6
The way that I let people I love run over me.,20,36,36,d,6
My taste in style and culture.,255,608,608,u,6
That I can be pretty creative around food,0,1,1,l,7
my stomach. I think it looks fat even though others disagree,31,97,97,d,7
"my friends refer to me as a ""human wikipedia""",55,37,37,u,7
I'am simple and beauty inside,85,216,216,l,8
lack of self confidence shy,8,46,46,d,8
There is nobody else on earth that's exactly the same like me.,74,413,413,u,8
my eyes,6,19,19,l,9
my weight,0,3,3,d,9
poetry writing,274,289,289,u,9
I like that I am smart and funny.,12,23,23,l,10
I dont like my temper.,23,91,91,d,10
my laugh is very unique.,0,0,0,u,10
I am a caring person.,28,85,85,l,11
I have a hairy back.,128,439,439,d,11
My perspective on life makes me unique.,135,99,99,u,11
I am married with three children.,70,202,202,l,12
I don't get to spend enought time with my kids due to work.,193,379,379,d,12
My name is Apacha and you will not find that anywhere else.,109,325,325,u,12
I pick up new technologies quickly,20,18,18,l,13
I worry about things I have no control over,7,16,16,d,13
I enjoy building things in my free time,159,343,343,u,13
I like that I am considered to be smart,15,43,43,l,14
I don't like that I drink too much beer,176,481,481,d,14
I was raised in church and my Father married my wife and I,192,469,469,u,14
"Kind, good listener, and friend.",1,2,2,l,15
Tend to become frustrated easily.,156,253,253,d,15
I have been with my spouse for half my life now.,300,193,193,u,15
I AM VERY CREATIVE IN MY APPROACH TO JUST ABOUT ANYTHING,209,143,143,l,16
I TEND TO HOLD GRUDGES,230,403,403,d,16
I AM A FANTASTIC WRITER,235,424,424,u,16
I am so creative and visionary.,0,1,1,l,17
I am not very physically attractive.,12,42,42,d,17
I march to the beat of my own drum.,44,32,32,u,17
I am extremely honest about my strengths and weaknesses.,17,29,29,l,18
I am not disciplined enough to lose the weight I need to lose.,0,3,3,d,18
I can be very honest without making the person I'm talking to feel bad.,40,29,29,u,18
I like that I am employed as a chemist,206,621,621,l,19
I don't like my weight,0,3,3,d,19
I am great at baking science and making things,25,8,8,u,19
i like my lack of motiviation someetimes,8,46,46,d,20
I am smart and an athlete,239,270,270,u,20
I like that I am very smart.,15,43,43,l,21
I do not like my body type.,104,236,236,d,21
I am unique because I am a good creative writer.,0,0,0,u,21
I like that I am a very good cook.,1,2,2,l,22
I don't like that I get easily hurt in relationships.,67,94,94,d,22
Something that makes me unique is my tattoos.,152,44,44,u,22
I really like my beautiful eyes.,186,113,113,l,23
I dislike that I have a chbby tummy.,243,407,407,d,23
My willingness to be submissive to my man is unique.,94,545,545,u,23
I like that I am kind to others and I smile at strangers.,23,51,51,l,24
I can get surly when I am tired.,171,228,228,d,24
"I sing very well, from the heart, and my voice is unique--as each of us has a unique voice.",0,0,0,u,24
I like my brown eyes.,37,95,95,l,25
I don't like my attitude when things go wrong.,226,298,298,d,25
I have a freckle on my eyelid.,268,293,293,u,25
I have a very positive outlook on life.,22,25,25,l,26
Sometimes I will be in a bad mood for no reason.,13,41,41,d,26
I have a very goofy sense of humor.,37,126,126,u,26
I like my sense of humor.,18,13,13,l,27
I don't like the fact that I am a worrier.,99,436,436,d,27
I am very curious and ecelectic in my tastes.,138,180,180,u,27
I am very open and caring toward other people.,45,133,133,l,28
I am overly critical of myself and very sensitive.,5,35,35,d,28
I have a very unusual sense of humor.,200,474,474,u,28
I am a nice person.,8,24,24,l,29
I am a very impatient person.,11,60,60,d,29
My eyes change depending on my mood.,49,19,19,u,29
I am a caring person.,28,85,85,l,30
I can be very indecisive.,129,452,452,d,30
I have traveled more than many people.,12,26,26,u,30
im smart caring loving person,194,163,163,l,31
i tend to get mad alot,55,116,116,d,31
i can wiggle both my ears up and down,123,437,437,u,31
Something that I like about myself is the ability to stay determined and work hard.,39,44,44,l,32
Something that I don't like about myself is that sometimes I fail to reach my goals.,35,44,44,d,32
Something that makes me unique is my athletic ability.,30,55,55,u,32
I love people.,16,12,12,l,33
I make lots of mistakes,119,446,446,d,33
I worry too much about things I can't change.,7,16,16,d,34
I have a really quirky sense of humor.,217,597,597,u,34
I am an unique individual.,89,0,0,l,35
I have no hair.,3,5,5,d,35
I love my werewolf books that I write.,307,524,524,u,35
I am an extremely motivated individual,103,81,81,l,36
I tend to have negative self-image issues,32,108,108,d,36
My life experiences make me who I am,2,4,4,u,36
I am very loyal to the company I work for.,33,61,61,l,37
I am on the lazy side when it comes to exercise.,1,7,7,d,37
"I am able to find the best deals or deals never thought of online for restaurants, travel, merchandise, and others.",6,14,14,u,37
"I am proud to be a mother, wife and wife pursuing my future career.",59,144,144,l,38
I don't like that I haven't always followed my dreams.,90,549,549,d,38
My positive outlook and life experiences make me unique.,13,25,25,u,38
I like my sense of humor and intelligence.,18,13,13,l,39
I don't like that I am impatient and lazy.,11,60,60,d,39
My life experiences make me unique -- living a different life than the one for which i was raised.,0,0,0,u,39
"I like that I have an optimistic outlook, even when things don't seem like they are going to go my way.",51,164,164,l,40
I don't like that I have a tendency to beat myself up over my imperfections.,27,119,119,d,40
I don't think it is any one thing that makes me unique but instead all of the characteristics combined that create my uniqueness.,205,476,476,u,40
I have really nice and friendly brown eyes.,8,24,24,l,41
I am really out of shape.,63,173,173,d,41
I can put both legs behind my head.,218,366,366,u,41
"I like my empathy, especially when it can affect other's positively.",42,155,155,l,42
I dislike myself when I get too worked up over something and am blinded by it.,51,112,112,d,42
I was brave enough to give up an ambitious jobs for a life that actually made me happy.,126,226,226,u,42
I am generally hard-working and try to finish every task I start.,221,612,612,l,43
I sometimes get overly critical of people instead of giving them the benefit of the doubt.,5,35,35,d,43
I am the only Jewish member of my Asian-American family.,9,53,53,u,43
I am capable of understanding people's inner motives and feelings without them needing to be said.,158,158,158,l,44
I am critical of the people that I love the most.,5,35,35,d,44
I have the ability to find something in common with a wide variety of people.,117,434,434,u,44
I like that I'm an attractive guy.,36,42,42,l,45
I don't like that I don't know what I'm going to do with my life.,4,4,4,d,45
i have ridden my bicycle across the United States.,194,227,227,u,45
I am a musician that has toured across America.,169,265,265,l,46
I can be very lazy at the begining of the day.,1,7,7,d,46
I have been able to stay sober for over four months without AA.,6,14,14,u,46
I like that I am a good listener.,1,2,2,l,47
I don't like that I am so shy.,2,20,20,d,47
My range of facial expressions makes me unique.,102,176,176,u,47
I like that I am creative,0,1,1,l,48
I don't like that I am a little bit lazy,33,177,177,d,48
"I am good at games, any game.",1,2,2,u,48
I like my sense of humor.,18,13,13,l,49
I have a large scar on my left wrist from when I fell while trying to climb a fence.,36,64,64,u,49
I am smart and able to fix most things.,19,14,14,l,50
I have a temper and sometime don't control it.,23,91,91,d,50
I can play most instruments and i can fix cars.,182,586,586,u,50
I am able to be kind and help someone in need.,19,14,14,l,51
I am a little selfish at times.,209,617,617,d,51
My personality is the most unique thing about me.,0,0,0,u,51
I like that I am a woman.,50,70,70,l,52
I do not like my weight.,0,3,3,d,52
I am unique because I enjoy writing in my journal at night before I go to bed.,0,0,0,u,52
I am a proud introvert.,59,144,144,l,53
I can be quite mean.,9,49,49,d,53
My combination of Disney nerd and perv sense of humor.,34,122,122,u,53
I like that I have a huge heart.,31,71,71,l,54
I don't like my weight.,0,3,3,d,54
I am good at plastic canvas.,1,2,2,u,54
I think I am funny and have a good sense of humor.,12,23,23,l,55
I sometimes suffer from low self-esteem.,46,184,184,d,55
I enjoy a wide variety of different hobbies and activities.,52,78,78,u,55
my commitment to relationships with friends and family,145,588,588,l,56
That I don't complete tasks that are difficult,217,167,167,d,56
I do not anger very easily,265,388,388,u,56
ability to relate to peoplw,10,15,15,l,57
laziness,81,213,213,d,57
diversity of interests,222,485,485,u,57
"I like my smarts, my eyes, and my hairs.",142,585,585,l,58
I don't like my weight.,0,3,3,d,58
"I think my reading and writing skills, as well as red hair make me unique",150,153,153,u,58
I like my brow hair and my green eyes.,60,72,72,l,59
I dont like the weight and size.,0,3,3,d,59
I use radio equipment to talk all around the world.,72,412,412,u,59
I am a skilled and creative knitter.,144,587,587,l,60
I am prone to depression and obsessional thinking.,179,599,599,d,60
I have lived in four different countries.,3,27,27,u,60
I am a moderately successful freelance artist.,47,109,109,l,61
I am often unhappy for very minor reasons.,72,421,421,d,61
I am a female that is awesome at welding/metal work/carpentry.,27,90,90,u,61
I love that I am very strong,21,28,28,l,62
The fact that I can draw makes me unique,318,80,80,u,62
I always am in a good mood.,1,2,2,l,63
I love technology as much as I love nature.,213,86,86,u,63
I like my spontaneous Creative nature.,184,111,111,l,64
I don't like my disorganization.,242,633,633,d,64
I can design amazing graphics.,278,290,290,u,64
"I've lived my life the way I wanted to, have grown and am happy now.",30,4,4,l,65
"I wish I had no regrets, but I do have some.",78,212,212,d,65
"My life experience makes me wise - I know that sounds egotistical, but I have lived a full, full life.",302,301,301,u,65
I like that I have a strong faith in Jesus Christ.,21,28,28,l,66
I don't like that it is hard for me to make friends.,56,37,37,d,66
I am loyal and honest to a fault.,312,61,61,u,66
My odd sense of humor always amuses at least me.,160,136,136,l,67
"My introverted nature makes me have to ""recharge my batteries"" after social interaction.",6,38,38,d,67
I can perform a one-handed clap.,249,605,605,u,67
I like the fact that I am artistic.,223,147,147,l,68
I don't like the fact that I am overweight and single.,24,87,87,d,68
The fact that I am able to connect with anyone I meet almost instantly makes me unique.,6,14,14,u,68
I like my willingness to make someone elses day better than my own.,43,32,32,l,69
I do not like that I can be judgmental towards others.,237,404,404,d,69
"I have only one dimple, and my laugh is silent.",203,362,362,u,69
"I make huge efforts to communicate with people, and help them communicate.",31,71,71,l,70
"I can be stubborn, and occasionally lazy.",1,7,7,d,70
"My odd sense of humor, and my strange creativity make me unique.",39,100,100,u,70
I have been told I have wonderful breasts.,163,365,365,l,71
I need to lose some weight; about 25 lbs.,0,3,3,d,71
My husband likes to watch me have sex with other men.,7,11,11,u,71
"I like that I am a kind, loyal person.",33,61,61,l,72
I don't like that I often get jealous and anxious.,25,77,77,d,72
I am a woman who hates children.,263,70,70,u,72
I have a good sense of humor.,1,2,2,l,73
I get frustrated easily when I have too many things to do.,17,26,26,d,73
"I enjoy learning new things, and I am not picky about what the topic is.",21,18,18,u,73
My calm attitiude to problems,165,259,259,l,74
Impatience when I want something done,200,607,607,d,74
Being Scottish and living in PA,119,330,330,u,74
I don't like that I am overweight.,24,87,87,d,75
I was in a maile dominated field and went to war as a civilian Army employee.,96,320,320,u,75
I like that I have the potential to be creative,0,1,1,l,76
I don't usually have any motivation to do things.,42,140,140,d,76
I really don't think I'm unique in any way,0,0,0,u,76
I really like the fact that I am a hard worker and have a faster pace than others.,4,9,9,l,77
I really don't like the fact that I am not productive with my time always. Especially knowing how fast I can complete things.,211,286,286,d,77
I work a silly career by choice that I creatively enjoy and it pays near to nothing.,170,458,458,u,77
I like that I am dependable and easygoing.,164,482,482,l,78
I don't like that I am lazy and introverted.,1,7,7,d,78
I like to be alone most of the time.,16,30,30,u,78
I have a great smile.,2,8,8,l,79
I can be uptight and impatient.,11,60,60,d,79
My  positive attituide makes me unique.,13,25,25,u,79
The thing I like most about myself is my hair.,55,30,30,l,80
The thing I like least about myself is my stomach.,173,136,136,d,80
I am unique because I am missing my smallest toe on my left foot.,0,0,0,u,80
I like the color of my eyes.,14,34,34,l,81
I don't like that I am overweight.,24,87,87,d,81
I have family that lives in Alaska and El Salvador.,51,161,161,u,81
I like that I put my friends in front of my own needs and always try to help them.,86,75,75,l,82
I don't like how I have no willpower.,15,82,82,d,82
I am unique because I always try to put a smile on my face.,0,0,0,u,82
I'm a very honest person.,17,29,29,l,83
I was spoiled by my parents and sometimes I dont behave well.,75,175,175,d,83
"I am a multitask person, very organized.",196,255,255,u,83
I like my hazel eyes and brown hair.,117,398,398,l,84
I do not like that I'm balding or becoming chubby.,43,131,131,d,84
My left hand's pinky is larger than my right hands pinky.,229,502,502,u,84
honest,17,29,29,l,85
overeactive,113,444,444,d,85
I love the color of my hair.,14,34,34,l,86
I dont like that my hair grows slowly.,3,5,5,d,86
I'm a left handed female.,27,90,90,u,86
I am fun to be with.,181,498,498,l,87
I have a bit of acne.,33,177,177,d,87
I can stick my tongue on my nose.,26,89,89,u,87
I am able to learn information independently without the guidance of a teacher.,19,14,14,l,88
I am often anxious in social situations.,34,128,128,d,88
I am the only female in my physics class.,9,53,53,u,88
That I can figure almost anything out,48,31,31,l,89
I am very shy when it comes to new people,2,20,20,d,89
I am very tall for a girl,60,118,118,u,89
i like that im a very caring person,3,10,10,l,90
the think i dont like about myself is that i tend to care what people think of me to much.,151,353,353,d,90
what makes me unique is that i act very goofy at times.,37,126,126,u,90
I like the shape of my head.,66,173,173,l,91
I do not like my super long penis.,140,574,574,d,91
I think that my thought process and outlook makes me unique.,191,390,390,u,91
I like how persistent I am.,49,194,194,l,92
I don't like that I have fibromyalgia,92,553,553,d,92
"I am an exotic mix of asian,pacific islander,and white races.",178,354,354,u,92
I like that I encourage others.,5,6,6,l,93
I sometimes can be too shy and not confident.,2,20,20,d,93
I can add numbers well in my head.,264,284,284,u,93
I like that I have a knack for understanding people and why they do things.,217,521,521,l,94
I would like to be more relaxed about things but have better organisation.,21,88,88,d,94
I am not very picky or decisive.,56,169,169,u,94
I like my level of physical fitness.,52,190,190,l,95
I don't like that I am very emotional.,48,186,186,d,95
I have a very unique name.,0,0,0,u,95
"I think I'm fairly creative, thoughtful, and have a wide variety of interests.",0,1,1,l,96
"I'm very conservative, and don't take too many risks.",121,567,567,d,96
"I have a lot of unique life experiences, and can say I've been to and done a lot of things most people haven't. :)",28,22,22,u,96
I have become much more independent.,207,512,512,l,97
I have a very quick temper.,36,65,65,d,97
I dont play games with people. I say what I mean.,289,142,142,u,97
I like my freckly face.,197,146,146,l,98
I do not like my depressive illness.,115,445,445,d,98
I like my desire to learn things.,105,550,550,u,98
I am very loyal,33,61,61,l,99
I am a jealous person,25,77,77,d,99
I tend to blurt out random thoughts that people find odd but interesting.,39,100,100,u,99
My smile makes other people happy. I don't have to try hard.,13,11,11,l,100
I give up if things aren't going my way or getting too tough.,153,465,465,d,100
Everyone is unique; I am unique because of my personal style and work experience.,0,0,0,u,100
i am a huge class clown,31,71,71,l,101
i drink alcohol too much,117,129,129,d,101
my personality is different than most,3,27,27,u,101
I have really nice blue eyes.,8,24,24,l,102
I hate that my balance sucks because of I have ataxia.,49,162,162,d,102
I survived addiction and my sisters death.,316,73,73,u,102
I like the fact that i am highly motivated.,225,80,80,l,103
I dont like the fact that i am very critical of myself.,5,35,35,d,103
My overall view on life is very unique.,97,149,149,u,103
I have a lot of patience.,32,22,22,l,104
I tend to procrastinate about doing things.,7,16,16,d,104
I am great at giving good advice to others.,25,8,8,u,104
I like the fact that I am a curious person interested in a lot of different things.,105,180,180,l,105
I don't like that I feel helpless in alleviating the stressors my loved ones experience.,207,230,230,d,105
I am extraordinarily empathetic with others.,148,592,592,u,105
I love that I am kind,23,51,51,l,106
I dont like that i can be mean,9,49,49,d,106
I think I am unique because i am strong,0,0,0,u,106
I like that I am intelligent and caring.,7,21,21,l,107
I do not like that I am a perfectionist and unable to make my own decisions.,28,151,151,d,107
I am unique because I love salsa dancing.,0,0,0,u,107
My will to get better at stuff. Such as sports and music.,24,39,39,l,108
Nothing. I tend to look at the positives on life.,168,300,300,d,108
"That is up to somebody else to explain, I've been told I am a great musician.",25,8,8,u,108
I am brave and always willing to try something new,123,317,317,l,109
I am impulsive and sometimes too quick to try something new,223,297,297,d,109
I am the type of person that seems outgoing but is actually shy sometimes.,112,20,20,u,109
"I like that i don't care what other think about my decision, I tend to do whatever I want without felling bad when people judge me.",13,11,11,l,110
I tend to be anti-social and find it hard to make friends.,103,535,535,d,110
I am unique because I am a natural medium between people and know how to stay out of other people's arguments.,0,0,0,u,110
I am a kind person.,23,51,51,l,111
I think I am too shy.,2,20,20,d,111
I am a strong person but not emotionally closed off.,24,28,28,u,111
I really like my hair color.,9,5,5,l,112
I don't like the texture of my hair.,133,106,106,d,112
I am unique because I was able to survive a condition that normally leads to death.,0,0,0,u,112
I like that I strive to be one of the best of what I do.,106,150,150,l,113
What I don't like about myself that I like to be lazy and relax all the time.,1,7,7,d,113
"What makes me unique is that I can sneak around unnoticed, which works really well to my advantage.",121,557,557,u,113
"I like my smile, and that whenever I smile it makes other people smile too.",13,11,11,l,114
"I hate that no matter how hard I try, I cannot stop myself from being horribly stubborn!",10,9,9,d,114
"I have a weird bladder disease called intercystial cystitis, and I don't know anyone else with this condition.",301,248,248,u,114
I am a loving mother who puts her kids' interests at the top of the list.,159,135,135,l,115
I have no willpower when it comes to losing weight,15,82,82,d,115
I can cross just my right eye while the left looks straight ahead,122,495,495,u,115
I am an adventurous spirit.,38,125,125,l,116
I can be awkward in foreign social situations.,146,461,461,d,116
I traveled India and Nepal by myself for 3 months.,113,327,327,u,116
I am very passionate about a few things,98,440,440,l,117
I get upset and angry very easily,235,145,145,d,117
I enjoy Chinese culture and learning new things,168,245,245,u,117
I like my job and my family.,124,154,154,l,118
I do not like my current weight.,122,234,234,d,118
My experiences and intellect makes me unique.,17,52,52,u,118
I like how strong,21,28,28,l,119
I've been married to the same woman for nearly 10 years.,203,165,165,l,120
I have to fight depression daily.,174,595,595,d,120
"Not to give too much personal information...my home town is owned by my Alma Mater.  http://en.wikipedia.org/wiki/Playas,_New_Mexico",33,121,121,u,120
I have a very sharp sense of humor.,196,285,285,l,121
I lack willpower when it comes to getting  in shape.,15,82,82,d,121
"I have a vast mental encyclopedia of random trivia, so I'm awesome at trivia games.",104,218,218,u,121
I like my strange and rare humor.,134,166,166,l,122
I don't like the fact that I cannot get along with many people.,17,26,26,d,122
"Everything about me is unique because there is no other ""me"".",0,0,0,u,122
I am good with computers,1,2,2,l,123
I am bad with money sometimes,13,41,41,d,123
"I like to rock climb in the rain. I guess that would be better if the question was ""what makes you stupid"", But it's all I can think of.",199,39,39,u,123
I like that I can play the guitar.,122,456,456,l,124
I have 2 guinea pigs named Potato and Chip.,144,447,447,u,124
I like how creative I am and how it helps me adapt to change.,0,1,1,l,125
I don't like my emotional dependence on food.,48,186,186,d,125
I am unique because I am 28 years old and still like to tell myself stories to go to sleep.,0,0,0,u,125
I clean up nice.,8,24,24,l,126
I am not spontaneous.,195,111,111,d,126
I am white but I speak Spanish,47,138,138,u,126
My body won't regenerate muscle and I keep losing it.,241,531,531,d,127
I know I've had a combination of  experiences like no other.,7,11,11,u,127
I like my desire and ability to constantly learn new things.,20,18,18,l,128
I don't like my tendency to procrastinate and come up with excuses.,27,119,119,d,128
"I have unique taste in things like movies, games, and music, and am very creative.",0,0,0,u,128
I like my adventurous tendencies.,38,125,125,l,129
I don't like my social anxiety.,6,38,38,d,129
My sense of humor makes me unique.,5,13,13,u,129
"I like that I am a mother, and am able to fill my calling in life to be a source of nurturing, growth, support, and love to my growing family.",19,14,14,l,130
I dislike that I often lack motivation to complete things and goals that are important to me.,227,626,626,d,130
"I am a very calm, tranquil, and kind person, and at the risk of sounding full of myself, people seem to comment on it and enjoy that aspect of my personality.",22,66,66,u,130
I TAKE PRIDE  IN THE FACT THAT I ALWAYS TRY TO DO A KIND THING FOR PEOPLE EVERDAY.,69,415,415,l,131
I DON'T LIKE THE FACT THAT I AM NOT ALWAYS VERY PATIENT.,238,195,195,d,131
I'M UNIQUE BECAUSE I ALWAYS TRY TO INSPIRE SOMEONE ON A DAILY BASIS.,107,552,552,u,131
I like how I can manipulate people.,16,12,12,l,132
I don't like how unassertive I am.,135,556,556,d,132
My hair goes down to mid-thigh.,238,318,318,u,132
"diligent, persistent, grit-minded, open minded, tactical",49,194,194,l,133
"lazy, depressed, procrastination, sex addict, self deprecation",1,7,7,d,133
"artistic, short, creative, athletic, talented, strong minded",314,147,147,u,133
I like that I smile a lot.,32,22,22,l,134
I don't like it that I'm not handy with fixing things.,89,541,541,d,134
Something that makes me unique is that I like playing old time music on the piano and have a HUGE collection of old sheet music.,20,58,58,u,134
I can make people laugh and enjoy life,16,12,12,l,135
Sometimes I get easily stressed out when things are not going well,7,16,16,d,135
I have dedicated my life to the public interest,2,4,4,u,135
I like that I strive to achieve my goals,172,185,185,l,136
I don't like my addiction to food,57,73,73,d,136
"I have a lot of different hobbies that don't usually connect, like metal detecting and robotics",3,27,27,u,136
I don't like that I am impatient,11,60,60,d,137
I am a very creative person,4,1,1,u,137
"I can find the humour in any situation, no matter how terrible.",175,351,351,l,138
I find it very hard to be happy.,182,40,40,d,138
