sent,rank,rank_a,cluster,type,num
I view the world unlike anyone I know.,19,55,55,u,138
I am taller than average.,61,169,169,l,139
I am above the national weight for a healthy person of my age.,107,437,437,d,139
My ability to enjoy life and take things as they come.,23,15,15,u,139
I like that I am intelligent.,10,24,24,l,140
I do not like that I am stubborn.,197,274,274,d,140
"I am a woman who drives a big truck, even though I am very ""girly"".",96,88,88,u,140
I'm a forgiving person to my family and friends,212,215,215,l,141
I sometimes lie to get my way,19,36,36,d,141
I able to find opportunity when others cannot.,312,518,518,u,141
My ability to handle tense situations.,9,15,15,l,142
My lack of patience when dealing with my spouse.,8,46,46,d,142
I've been told I am extremely intelligent.,281,24,24,u,142
I like that I am smart and competant.,89,426,426,l,143
My insane reflexes and my unique sense of humor,123,434,434,u,143
I am a more successful parent than my mother.,46,109,109,l,144
Missing my bottom front teeth; I'm getting implants to fix the mouth.,117,562,562,d,144
"Grew up poor, now I'm in the top 3% of Americans.  Class mobility is still alive, no matter what critics may say!",124,616,616,u,144
I like that I am a modest person.,211,564,564,l,145
I don't like that I am painfully shy.,2,20,20,d,145
I am biracial and have been lucky enough to see other parts of the world.,65,304,304,u,145
"I like my hair, it's long and lucious",43,49,49,l,146
i don't like my skinny calves,231,402,402,d,146
i have a really really long tongue,26,89,89,u,146
I like my personality is great.,2,7,7,l,147
I don't like my level of patience.,94,219,219,d,147
My warm personality makes me unique.,227,264,264,u,147
I like my confidence and ability to teach and share my skills with others.,153,107,107,l,148
I can be afraid to voice myself at time with those who are in positions of authority.,142,241,241,d,148
I like to anonymously help others with their problems or needs.,11,6,6,u,148
I like that I have continued my education because I enjoy learning.,198,501,501,l,149
I don't like how easily I lose my temper when people present ignorant arguments.,187,486,486,d,149
I am unique because I have a strange combination of interests and hobbies; I enjoy working with electronics but love the outdoors as well.,0,0,0,u,149
I like my positive energy.,22,23,23,l,150
I dislike how instinctively I can criticize others.,138,6,6,d,150
"I am a uniquely creative, smart, and physically capable person.",4,2,2,u,150
"I like my personality, I am funny and I don't take things personally.",12,21,21,l,151
I wish I was better at controlling my temper.,22,91,91,d,151
I am funny looking and very creative.,29,21,21,u,151
I like that I am eager for success.,64,324,324,l,152
I do mTurk as primary income.,82,352,352,d,152
"honest, creative, good-looking, trustworthy, reliable",0,2,2,l,153
"lazy, critical, negative, self-conscious, forgetful",5,34,34,d,153
"creative, resourceful, approachable, funny, multitalented",4,2,2,u,153
My ability to fix things.,9,15,15,l,154
My social anxiety and difficulty making new friends.,6,38,38,d,154
"Well, I suppose the shape of my nose is pretty unique.",0,0,0,u,154
"smart, asian, handsome, thinker, cool",67,60,60,l,155
"young, short, crazy, love, small",70,203,203,d,155
"asian, smart, cool, thinking, amazing",31,60,60,u,155
I have a silly personality and easily make people laugh.,25,32,32,l,156
I am currently morbidly obese.,181,480,480,d,156
I gave my high school yearbook its name.,183,265,265,u,156
"I like my long, slim yet toned legs.",43,49,49,l,157
I don't like how insecure I can be sometimes.,221,293,293,d,157
I am unique because I approach everything as if it were a logic puzzle that needed solving.,0,0,0,u,157
I like that I am able to read quite quickly.,19,14,14,l,158
I don't like that I am unable to make tons of money simply by wishing for it.,27,150,150,d,158
I am uniquely qualified to be chosen as the world's representative to the Starlight Galactic Union.,19,55,55,u,158
I like that I'm athletic.,33,54,54,l,159
I don't like that I'm not as driven in life as I used to be.,224,513,513,d,159
I am able to teach tennis.,6,14,14,u,159
I like my eyes and their color.,5,19,19,l,160
I don't like my hair and its color.,3,5,5,d,160
The way I dress is nice.,283,22,22,u,160
I like the fact that I'm very nice.,6,22,22,l,161
I'm pretty good at creating interactive web pages.,1,1,1,u,161
I like the fact that I'm intelligent.,10,24,24,l,162
I don't like that I'm sometimes too intense.,210,571,571,d,162
What makes me unique is my extreme love of books over movies.,163,240,240,u,162
i like my eyes cuz they are green,60,70,70,l,163
i dont like my tummy,46,138,138,d,163
my personality makes me unique,18,32,32,u,163
I like that I'm a hard worker.,3,8,8,l,164
I don't like how much hair I have.,3,5,5,d,164
I am a twin and from Chicago.,186,155,155,u,164
I like how I often try to find quantitative problems and finding interesting solutions for them.,187,526,526,l,165
"I don't like how internalized most of my thinking is (less group think, more individual & isolated methods).",225,30,30,d,165
"I believe that my interest in statistics of board games, which most of my friends overlook, makes me unique.",49,158,158,u,165
I like the way i think,29,36,36,l,166
i don't like my skin,64,199,199,d,166
I have 5 kids now,141,483,483,u,166
"I'm a very hard worker, and honest person.",3,8,8,l,167
"Alcohol addiction, lack of a stable life.",76,380,380,d,167
Intelligent at anything to do with computers!,262,500,500,u,167
I am creative and a problem solver.,0,2,2,l,168
I worry about too much.,44,85,85,d,168
I do not drink any alcohol at all but am not an alcoholoc,172,128,128,u,168
I am a very creative person.,0,2,2,l,169
I get worried way to easily.,19,36,36,d,169
I know how to speak Russian.,214,258,258,u,169
I really like my organizational skills and how I can lead a group to stay on task.,193,608,608,l,170
I don't like that I am not musically inclined. I can't read music and can't appreciate it.,177,48,48,d,170
I love to volunteer and give my time to help others. I even donate blood and have donated my hair for a wig.,182,428,428,u,170
I like that I am enthusiastic about the day ahead and want to get many things completed.,183,421,421,l,171
I don't like how I am often weighed down by the minutia of the tasks I do.,206,499,499,d,171
I always look for the positive in situations while others are complaining about an occurrence.,13,23,23,u,171
i treat others with respect,4,6,6,l,172
i lack motivation to improve myself sometimes,41,139,139,d,172
i spent a long time living overseas,206,49,49,u,172
i am a great mother,2,7,7,l,173
i dont like that im over weight,205,161,161,d,173
"i deal with a lot of pain and stress, but manage to stay positive",13,23,23,u,173
I like that I am patient.,116,566,566,l,174
"I am not your average girly girl, but im not a tom boy.",303,78,78,u,174
I really like my ability to excel.,9,15,15,l,175
I really don't like my inability to be humble.,234,521,521,d,175
I am not only extreme lazy but also extraordinarily motivated.,153,9,9,u,175
I am a born again Christian.,199,388,388,l,176
I have been overweight for a number of years.,67,318,318,d,176
I was the master of ceremonies for the last Christmas program at my elementary school before it closed.,166,154,154,u,176
I'm an experienced computer nerd.,154,180,180,l,177
I am definitely a computer nerd.,194,180,180,d,177
I'm work as a moderator on a tech support forum online.,241,110,110,u,177
How optimistic I am,50,162,162,l,178
My weight,0,3,3,d,178
My personality,18,32,32,u,178
"I like my personality, because I'm very outgoing.",25,32,32,l,179
"I dont like my facial looks. I know I""m not ugly, but I have a big nose.",84,174,174,d,179
I'm unique because I am good at multitasking.,0,0,0,u,179
I feel good about my health.,1,1,1,l,180
People have said I'm entertaining.,168,345,345,u,180
I like that my intelligence provides beauty to the world.,26,53,53,l,181
I don't like my inability to get a lot of progress made in my life.,36,177,177,d,181
I have a breadth of knowledge that always helps me talk about anything.,64,194,194,u,181
I like that I am meticulous about everything I do. I seek perfection.,71,302,302,l,182
Sometimes I am too timid infront of people.,43,133,133,d,182
I have a really good analytical skill and I can see patterns easily.,1,1,1,u,182
my ability to drive through a task to completion,9,15,15,l,183
my ability to focus on the completion,131,15,15,d,183
my sense of meaning from others,5,12,12,u,183
I like that I am intelligent.,10,24,24,l,184
I do not like the face that I am introverted,236,145,145,d,184
I care deeply about my parents.,87,173,173,u,184
I like my sense of humor.,18,12,12,l,185
I don't like my inability to say no sometimes.,36,177,177,d,185
I love how awesome i am,189,67,67,l,186
i hate that i dont have a twin as awesome as me,158,155,155,d,186
i am unique because i have a secret,0,0,0,u,186
I like my sense of humor.,18,12,12,l,187
I don't like my anxiety.,190,372,372,d,187
My two front teeth are not my real teeth.,102,73,73,u,187
I like the fact that I am always interested in learning new things.,34,190,190,l,188
I don't like that sometimes I procrastinate and play video games too much.,218,141,141,d,188
I am very good at almost everything I do and I like to perfect everything.,1,1,1,u,188
My intelligence surpasses others because it is above the above average mark.,26,53,53,l,189
My face is not as attractive compared to others.,11,42,42,d,189
"My perseverance, critical thinking skills, and passion for something I like makes me stand out.",146,34,34,u,189
I have a very inventive and creative mind,100,353,353,l,190
That I have no problem accepting people for who they are!,52,185,185,u,190
I like that I am nice and accepting of people.,6,22,22,l,191
I am unique because I am the only girl I know that hunts.,0,0,0,u,191
"I like that when I go to work, people seem to have a better day.",24,39,39,l,192
I don't like how I interrupt other peoples conversations without them asking me to.,215,10,10,d,192
"I am a very quick debater and love to argue, just to make sure people stand behind what they say.",230,63,63,u,192
I like my attitude towards life about myself.,109,307,307,l,193
I don't like the fact that I can't hold onto money.,119,79,79,d,193
I am unique because of the way I look.,0,0,0,u,193
I'm losing weight nearly at my goal weight.,40,3,3,l,194
"I'm alone, it's a hard thing to deal with",9,8,8,d,194
My beard is one people don't have,219,363,363,u,194
I like that I am quite intelligent,10,24,24,l,195
I don't like how shy and reserved I am,2,20,20,d,195
I am unique because I care little about what others think of me,0,0,0,u,195
I like that I'm funny.,12,21,21,l,196
I used to play video games competitively.,133,98,98,u,196
I can make people happy.,45,40,40,l,197
I can be a lazy person.,1,9,9,d,197
I can read very fast.,239,181,181,u,197
I can help people through difficult times,83,165,165,l,198
I have horrible self confidence issues,123,445,445,d,198
My hair is pretty unique,0,0,0,u,198
I can make a large crowd of people laugh.,94,62,62,l,199
I don't think I'm very attractive or photogenic.,11,42,42,d,199
I take the esoteric approach to life.,223,367,367,u,199
I am a very hard worker.,3,8,8,l,200
I don't exercise as much as I should.,44,85,85,d,200
My ability to manage any problem that occurs.,23,15,15,u,200
I like the fact that I'm a genuinely good person.,1,1,1,l,201
I don't like the fact that I hate speaking in public.,125,102,102,d,201
I listen to Catholic-oriented CDs in my car.,81,218,218,u,201
I like how honest and comical I am.,17,29,29,l,202
I don't like how shy and quiet I am at times.,2,20,20,d,202
I think for myself and have my own set of beliefs.,43,35,35,u,202
I genuinely care about others.,4,6,6,l,203
I haven't figured out how to achieve balance in all areas of my life.,48,160,160,d,203
I am able to make my daughter smile even when she's upset.,6,14,14,u,203
I like that I'm outspoken and not afraid to say what I think.,138,514,514,l,204
I don't like that I have an anxiety disorder and that I'm paranoid.,68,414,414,d,204
"I never get embarrassed and although many have tried, they have all failed.",12,26,26,u,204
I care about people a great deal.,2,7,7,l,205
I constantly struggle in maintaining a healthy weight.,137,341,341,d,205
"I tend to like things that are ""unpopular"" or unique.",256,487,487,u,205
"I am a hard worker, and I am a great listener.",3,8,8,l,206
"I procrastinate too much, and don't do anything to correct it.",144,31,31,d,206
I love the taste of slightly burnt popcorn.,60,544,544,u,206
I really like that I can learn anything quickly.,47,31,31,l,207
I do not like that I have very low impulse control.,45,182,182,d,207
I am the only one on this planet who has all of my individual experiences.,9,52,52,u,207
I am very smart in certain situations,188,603,603,l,208
I am very cautious around some people,185,319,319,d,208
I can tolerate things that people cannot,15,16,16,u,208
I have good taste in TV,1,1,1,l,209
I waste too much time with distractions,199,276,276,d,209
I have an oddball sense of humor,187,471,471,u,209
i like how my hair looks all day,8,5,5,l,210
i dont like that i am fat and too big,30,97,97,d,210
i like to be a bible reader and with family,70,600,600,u,210
I love my thick thighs.,150,131,131,l,211
I do not like my toes.,130,322,322,d,211
I absolute love potato salad,44,105,105,u,211
I have nicely shaped muscular shoulders.,191,605,605,l,212
I have way too much body hair.,3,5,5,d,212
I have had a planned home birth,56,187,187,u,212
I like my generosity and kindness toward others.,177,598,598,l,213
I don't like my weak willpower.,134,452,452,d,213
My ability to help others without wanting anything in return.,23,15,15,u,213
smart funny caring pretty woman,15,43,43,l,214
i tend to get upset and mad alot,54,115,115,d,214
wiggle both my ear up and down and make clover with tongue,26,89,89,u,214
I am highly motivated and will complete majority of tasks presented to me.,165,539,539,l,215
I procrastinate a lot of times when I have down time.,21,25,25,d,215
I observe most all situations and people around me.,16,30,30,u,215
My curiosity and love of reading.,213,296,296,l,216
My health problems that have interfered with my life.,122,334,334,d,216
"My experiences, worldview, and so on.",17,51,51,u,216
Something that I like about myself is my resilience after encountering a setback.,38,44,44,l,217
Something I do not like about myself is that I am prone to depression.,34,44,44,d,217
Something that makes me unique is my ability to create simple instructions for complex tasks.,179,172,172,u,217
One thing I like about myself is my personality.,134,75,75,l,218
One thing I don't like about myself is my lack of math skills.,37,75,75,d,218
One thing that makes me unique is my openess to new ideas and people.,21,18,18,u,218
My sizable work ethic and willingness to sacrifice leisure hours.,168,369,369,l,219
My inability to relax properly or cool down after a long job.,222,49,49,d,219
"My masterful piano skills, which incorporate electronic and dance yet hearken back to classical and Baroque pieces.",155,451,451,u,219
I like my capacity to grow and learn from ever-shifting situations.,124,357,357,l,220
"That's hard to say, because I'm limited like everyone else, but I tend to adapt.",9,8,8,d,220
"The me-ness of me, something you can only know by knowing me.",174,425,425,u,220
my hair looks cool,8,5,5,l,221
im kind of stupid,96,429,429,d,221
i can smoke a lot of pot,28,25,25,u,221
i love doing photography its my talent,81,419,419,l,222
i dont like that i am shy,2,20,20,d,222
i have a learning disability that makes me unique,82,202,202,u,222
i am athletic,33,54,54,l,223
i can be lazy,1,9,9,d,223
my dream is to swim the english channel,289,524,524,u,223
"I'm a pretty smart guy, overall.",82,148,148,l,224
I really need to lose weight.,0,3,3,d,224
I've lived on almost every continent.,74,534,534,u,224
I like that I am very smart.,15,43,43,l,225
I don't like that I'm passive.,166,538,538,d,225
I am a very tall Asian.,59,117,117,u,225
I like the color and texture of my hair.,14,33,33,l,226
"I don't like my abs and core, they are thick and chubby.",163,131,131,d,226
I am a visual artist who sees the world as a piece of art.,305,263,263,u,226
"I""m very compassionate and have a great  deal of empathy for others.",92,221,221,l,227
I tend to procrastinate and always finish things at the last minute.,219,509,509,d,227
I'm very unique and don't copy others.,0,0,0,u,227
I am an intelligent person.,10,24,24,l,228
I am severely overweight and can't seem to lose weight.,0,3,3,d,228
I am a person that can evaluate the logic of an argument.,58,13,13,u,228
I have a hard time achieving goals at times,9,8,8,d,229
I think that i am generally much friendlier than others.,100,301,301,u,229
I like that I am a caring person.,28,84,84,l,230
I don't like that I do not have a lot of patience.,21,25,25,d,230
I am unique because I have quit everything I ever started.,0,0,0,u,230
I have the ability to see things from other people's perspective on a regular basis.,13,10,10,l,231
I have very little will power over food.,28,122,122,d,231
I am a 7th generation Texan with family dating back to the 1840s.,258,227,227,u,231
I like my smile and my eyes.,79,208,208,l,232
I'm not fond of my waistline.,147,406,406,d,232
I am a transgender man who lives openly.,280,613,613,u,232
I am talented and creative.,0,2,2,l,233
I am a little lazy and like to procrastinate.,1,9,9,d,233
I have a large family.,35,62,62,u,233
I like my hair.,8,5,5,l,234
I dont like my knee caps.,161,398,398,d,234
They color of my eyes.,48,19,19,u,234
My will and determination in any situation.,147,497,497,l,235
I wish I was a couple of inches taller.,57,169,169,d,235
My combination of looks and intelligence.,34,121,121,u,235
I am a very positive person,22,23,23,l,236
I could lose some weight,0,3,3,d,236
I am usually always happy,47,40,40,u,236
I like that I am creative.,0,2,2,l,237
I don't like that I feel jealous of others at times.,24,76,76,d,237
I an uniquely funny and I say interesting things that catch people off-guard sometimes.,29,21,21,u,237
I like that I am good at a lot of things.,1,1,1,l,238
I dislike that my head is so round my friends call me pumpkin head.,49,45,45,d,238
"I am unique because I am juggle, and not many people can do that.",0,0,0,u,238
I like that I'm trying to better myself.,24,39,39,l,239
My lazyness.,216,614,614,d,239
I have cancer.,178,462,462,u,239
I care about the feelings of others.,144,617,617,l,240
I put the needs of others before my own needs too often.,40,35,35,d,240
I listen to types of music that most people don't listen to.,45,48,48,u,240
"I think I'm fairly creative, and can write critically.",0,2,2,l,241
I wish I was more forward and aggressive sometimes. I let a lot of things slide.,20,87,87,d,241
"I have an amazing memory - I can recite dialogue, events, conversations, and more..",213,257,257,u,241
I like that I am attractive.,35,42,42,l,242
I don't like that I don't have a job.,136,152,152,d,242
I think I am unique because I was in the Air Force.,0,0,0,u,242
I am intelligent and hard working.,10,24,24,l,243
I suffer from chronic pain.,150,584,584,d,243
I have two different colored eyes.,3,27,27,u,243
"I'm creative, friendly, nice, hard working, and I'm great in bed.",0,2,2,l,244
"I can be be non-confrontational or timid, especially at inopportune times.",124,312,312,d,244
"Too many things to name I suppose, but I'd say I'm unique because of my creativity.",12,26,26,u,244
I like that I am sociable because it helps me to adapt to situations.,125,239,239,l,245
I do not like that I have a bad habit of procrastinating which frequently makes me miss deadlines.,12,41,41,d,245
The fact that I am a 6'2'' female makes me unique because I am a foot taller than some of my friends,27,90,90,u,245
I like my brown eyes.,36,95,95,l,246
I do not like my nose.,127,176,176,d,246
I am very good at painting nails.,1,1,1,u,246
"I like my ability to react quickly in stressful, demanding situations.",214,231,231,l,247
I don't like my ever-growing beer belly.,73,351,351,d,247
"I am a member of the .4 club and on that night, I walked over 2 miles home through the woods.",272,503,503,u,247
I treat others the way I'd like to be treated.,4,6,6,l,248
I waste too much time doing unimportant things.,83,422,422,d,248
I will try almost anything once.,14,31,31,u,248
i liked how i am nice.,6,22,22,l,249
i dont like how i can be mean.,13,74,74,d,249
i am very good with technology.,1,1,1,u,249
I like my strong moral character.,21,28,28,l,250
I don't like the vulnerabilities I reveal while doing the right thing at all times.,95,389,389,d,250
What makes me unique is the understanding I have for my flaws and problems but I have become accepting of these and complacent in life.,159,103,103,u,250
